Rating,Review
4,tempatnya ternyata taman banyak restoran kafekafe bersantai ngobrol bersama teman keluarga kesini siang hari terasa panasnya meskipun cukup banyak area hijau banyak spot estetik ditiap depan kafe resto cantik fotofoto
4,banyak pohon rindang tinggi menjulang tak jarang ditemui rusa tempat rusa keadaan terikat terdapat beberapa besi bergantung restop beberapa pohon tampak tumbang mungkin usia tua kebersihan taman cukup baik tepat jalan santai
4,sebaiknya pemerintah menambah jumlah tong sampah disekitar pantai pengunjung sadar diri membuang sampah tempatnya pantaibersihpengunjungpunsenang
4,jangan dateng jam 910 karna muacet pol dateng pagi biar sepi parkiran ytta dalem jangan parkir yg luar kalo karna kemarin dateng pas public holiday jadi rame banget huhu ga explore semua cuma goa belanda goa jepang banyak warung jadi yg lupa bawa minum aman mostly gabisa cashless disarankan bawa cash yaa
4,masyaa allah tabaarakallah tempat wisata yg baru bbrp bulan buka wahana anak ayunan perosotan kolam renang 1 kolam 4x20mtr kurang lebih beberp villa sekedar masukan manajemen setempat tong sampang diperbanyak tempat toilet sedikit air keran jam 3 sore sdh tdk ngalir diperbanyak tempat berteduh krn panas siang hari menyengat sangat ruang bilas yg tdk dekat kolam musholla jauh
4,biasa aja sih buat spesial tempatnya bersih sejuk kalau pas terik matahari panasnya allah lebih baik bawa tikar sendiri kalau mau duduk2 biasa kendari orang mau duduk gazebo bayar ndak pantai kebun tempat wisata bayar terus padahal harusnya pengelola wisata menyediakan kebutuhan utk duduk pengunjungnya bos meski banyak masuk kan bayar anak anak main air sungai kalau minggu pagi rame sekali biasa ibu2 senam camping ground mushola cocok kegiatan outdoor rame rame
4,pantainya cantik sayang sekali sampahnya banyak berserakan
4,tempatnya cocok singgah mencari sedikit kesejukan banyak pepohonan rindang sumber air sungai tiket masuk parkir banyak warungwarung menjual aneka makanan minuman harga tergolong murah toilet berbayar kotor bau musholla jarang dibersihkan
4,masyaallah kemiringannya lumayan curam tetap berhatihati selama menaiki menuruni tangga banyak tempat istirahat view bagus cocok banget pendaki selebgram
4,benteng pertama peninggalan portugis datang ternate mencari rempahrempah sini tempat sultan khairun jebak bunuh tentara portugis benteng menjadi saksi bisu kondisinya seakan terawat pemugaran pemerintah daerah tamantaman urus
4,tempat indah menyaksikan senja menenggelamkan kenangan tak terulang
4,wisata permandian cukup terkenal kota palopo lokasinya daerah latuppa tempat rekreasi air wahana jg dilengkapi hotel agrowisata dikelilingi tanaman buah2an cukup subur durian duku lengkengrambutan
4,bundaran ikon kota palangka raya terdapat mesjid kubah kecubung spbu sebelah kiri jalan perempatan arah jalan soekarno hatta tembus jl g obos sebelah kanan menuju jl adonis samad arah bandara tjilik riwut kalau lurus arah kota jl rta milono
4,berada bawah kaki gunung salak cocok banget mau liburan akses jalan lumayan mudah mau kemping sewa penginapan banyak banget
4,tempat ibadah tenang ditengah kota solobangunan depan cukup moderndisisi samping gedung kuil kecil mirip candi putih thailanddan kalau dibilang berkunjung disini berasa solo rasa thailand
4,akses yg kurang bersahabat pengendara pemula terbayar puncaknya
4,taman area komplek dateng kesini pagi2 belom terlalu ramai aera kolam renang nya udh rame sih parkir 3000 kalo mau kolam renang wahana nya berbayar kandang kelinci lucu2 cuma kurang terawat aja depan pintu masuk banyak yg jualan jajanan mungkin klo dateng nya weekend rame kali yaa lumayan lah buat ajak bocil jalan2 mah
4,pemandngan dn suasana nya adem bangetairnya jernih ikan peliharaan cantikcantik
4,semoga kalau event besar tengah malam warawiri nya selalu dioperasikan at least 1 jam event lah pintu halte tj dibuka lumayan naik amari tp ga pusing akses halte nya minus bintang satu sama kayak taman bagian selatan timur beli tiket web resminya kena charge 5k tau ternyata murahan beli app sebelah
4,datang paling pertama jam 0900 pagi pas bru buka jd dpt semua spot photo ngantri bagus bersih jga restoran nya enak view bagus
4,salah satu tempat wisata solo sejak dipugar zaman pemerintahan bpk joko widodo benteng peninggalan belanda dulu digunakan mengawasi gerakan keraton surakarta lokasi dekat pusat wisata lainnya dekat pusat perbelanjaan solo cukup berjalan kaki menjangkau berbagai tempat
4,tempat rekreasi paling populer provinsi jambi luas area luar biasa banyak wahana rekreasi tata kelola taman baik cocok wisata keluarga besar pasangan
4,the place is just beautiful better go at sunset time you will have an incredible view over the coast line tondano lake and even the tangkoko volcano i didnt give 5 stars for two reasons 1there are only two view points both of them are incomplete and definitely not safe to climb 2you can do a round trip all around the crater but you cannot see anything because you will surrounded by a dense and high canopy in both side so you will not see anything except the path
4,taman tempat bermain anakanak tengah kota tepatnya perum 1 tangerang cocok membawa anak2 tempatnya adem nyaman banyak jajanan murah menyewa mainan mobil2an skuter murah meriah 10k 15 menit sayang banyak fasilitas ayunan perosotan yg rusak bermain anak mengantri main lebih lengkap jalan sedikit arah belakan play ground yg lumayan anak bermain tp saking ramenya jadi mengantri anak kalau mau maen perosotan ayunan
4,gapura tugu selamat datang kota lhokseumaweaceh
4,seru buat suka sepedahan tanjakannya cukup curam jadi butuh usaha ekstra buat dorong sepeda atas pas turunnya hati2 pesepeda pemula pemandangannya bagus asri 34 puncak warung semoga kedepannya dikelola lebih baik
4,lokasinya pinggir jalan padat parkirannya luas toko oleholehnya luas produk dijual berupa kaos souvenir kerajinan makanan khastradisional datang sabtu pagi jam 930 jadi ramai parkiran kosong foodcourtnya banyak buka katanya baru jam 10 kalo foodcourtnya tempat duduk lumayan banyak tempatnya sempit terbatas sepertinya banyak pengujung full varian makanan minuman foodcourt cukup beragam makanan tradisional makanan jepangkorea tempatnya bagus fotofoto sih makan sepertinya kurang worthed
4,hidden beach great place to chill and swim with beautiful corals
4,seru pusat keramaian salatiga mainan anak jogging track gym refleksi bangku istirahat air bersih toilet dekat masjid area makan penuh seputar alunalun
4,pantai senja malaka terletak panjang bandar lampung mengunjungi senja malaka bagus sore hari melihat matahari tenggelam balik bukit menikmati indahnya pantai pesan makanan diantar dinikmati pondokan pondokan diatas laut
4,serasa thailand wlu blom da tempat beli minum koq pakde jual bakso yg endes bgt
4,sini tama wet sendi semacam taman buat foto2 dulu pandemi infonya rame banget bagus sayang pandemi jadi terlihat kurang terawat
4,salah satu gong perdamaian dunia berada kota kupang propinsi nusa tengara timur gong perdamaian berada tengah taman nostalgia kota kupang terawat baik mengunjungi tempat dipagi hari mengambil foto lebih dekat akses gong perdamaian ditutup ambil foto jarak jauh sangat indah pemandangan disekitarnya
4,the place is comfortable but perhaps additional facilities need to be provided for children and a safer guardrail
4,tempat camping bagus lokasi terlalu jauh kota gorontalo nyaman keluarga mck tersedia dekat tempat mendirikan tenda musholanya masya allahterbaik tempat wisata alam pernah kunjungi full ac interior modern bersih terlalu jauh cuma akses masuk lokasi perlu diperbaiki dibetonaspal jadi licin kalau hujan
4,tempat yg bagus merenung karrna disana sepi pemandangannya sangat indah tempatnya perlu rehab lebih cantik
4,taman macan asri bersih menyejukkan hehehe taman berada ditengah kota dihimpit geduggedung kendaraan lalu lalang seru sih nih taman dipaksakan memberi kesejukan tengah garangnya polusi meski ribut suara kendaraan sanymgat ayak baik berolahraga jalan santai berkeliling taman
4,bukit kursi merupakan bangunan benteng dibuat bersiap menghadapi serangan belanda abad xviii pusat kerajaan berada kota piring biram dewa tanjungpinang timur benteng pertahanan termasuk terbaik masa dilengkapi meriam
4,tempat terbuka yg luas ramah buat semua orang lapangan bola tenpat bermain anak anak banyak acara jg selenggarakan ramai penjual jajanan hari pekan hari minggu parkiran mobil penuh asyik banyak penjual jajan jajan kampung
4,lokasinya masuk dalem gang jadi awalnya kebingungan masuk lumayan enak tempatnya not bad lah
4,lokasi nyaman keluarga baik sekedar bersantai mengadakan kegiatan lainya lokasi berada pinggir laut mrnjadi piluhan tepat untum kolega bersantai menikmati sejuknya hutan mangrove beragam fasilitas disediakan pengelola dilengkapi banyak gazebo digunakan bersantai
4,tempatnya enak adem cukup ramai kolam ikan kolam renang area memancing playground anakanak mancing lele main mobilmobilan masuk cuma bayar parkir doang motor 3k kayaknya aku lupa beberapa yg jual streetfood kayak crepes pentol sempol telur gulung bapakbapak ngopi warung
4,parkir 2ribu tempat sampah susah dicari sampah berserakan toilet 2ribu gazebo pendopo buat bersantai banyak warung orang jualan lumayan terus dikembangkan
4,walaupun akses menuju sini luar biasa sulit menggunakan beberapa moda transportasi banda aceh pantainya memang cukup menyenangkan area khusus snorkeling dizonasi membuat aman biota lautnya cukup bagus beragam
4,sumber mata air berada tengah sawah dimanfaatkam warga mandi mencuci tempatnya bersih air jernih pengunjung memarkirkan kendaraannya sd n citrosono pinggir warung sebelah tkpaud citrosono lalu berjalan kaki menyusuri sawah kurang lebih 200 m mulai sekarang pihak warung menarik retribusi parkir rp2000
4,salah satu tempat wisata dibilang ngetren daerah banjarbaru kn padahal sih tempat wisatanya lebih cocok buat piknik bersama keluarga dudukduduk menikmati senja matahari turun yakan alhamdulillah tempat wisata dekat sekolah sdn 3 palam jadi guruguru menjadikan tempat wisata danau galuh cempak sekedar rekreasi makan bersama bahkan sekalian membawa anak muridmurid bermain belajar alam sesuai ketentuan kurikulum kalo weekend biasanya lumayan ramai disini harga masuknya 5000orang gak tau deh sekarang berapa kalo weekend sama berbeda
4,nyaman bagus cuma jual makanan kurang cm 1 warung kecil sayang klo d rumah makan selalu buka malam tambah mantao
4,waktu tepat tebing breksi sore hari terlalu panas lumayan ramai akhir pekan liburan membosankan perlu coba naik jeep offroad rutenya tebing breksi seru menyenangkan driver jeep nya asyik merangkap jadi fotografer hasil fotonya bagusbagus
4,lokasinya jauh pusat kota tempat aslinya merupakan taman nama tugu pensil memang tugu berbentuk pensil tempat lokasinya dekat laut mana balik taman pantai dikunjungi beberapa arena bermain anak taman lapangan tenis tempat duduk sayangnya lokasinya terawat terlihat kotor terbengkalai tempat sepi kunjungi beberapa orang sedang lokasi uang tiket masuk tempat parkiran terbatas parkir sisi jalan raya dekat area taman tugu pensil
4,the park is very dry and the walk board is open with no shade you can bring an umbrella the rangers give you water before starting they give commentaries of the trees and the island there is a museum in rinca island which has ac and with the skeletons of the dragons they hide under shade during very hot weather there are buffalos and gazelles roaming around for the komodos to eat
4,salah satu pintu masuk keluar kawasan ancol lebih dekat arah pantai mall bila lewat pintu dibandingkan pintu barat kalau pintu barat lebih dekat dufan hotel restoran
4,terdapat beberapa tempat makan khas singkawang menu favorit bubur sapi bubu sapi isinya berkuah sop harganya murah ratarata tempat makan menjual menu makanan pagi hari lokasi ramai dikunjungi pengunjung sarapan
4,tempat rekreasi membeli buah2 an segar langsung pohonharga murah kualitas buah terjamin
4,silo yg merupakan 3 bangunan raksasa yg dibangun tempat penyimpanan batubara
4,2 kali nya bukit nobita pertama pagi hari 2 sore hari krn penasaran sama view kota padang malam hari turun nya menantang sekali bawa 2 anak usia 6thn 3thn alhamdulillah aman meskipun penerangannya sangat kurang tp skrg sedang bangun jalan kendaraan kemungkinan maret siap kata pedagang sana jd yg ga kuat mendaki tetap bukit nobita sabar
4,cocok tempat piknik maupun berkemah tempat nya luas nyaman biaya masuk 5 rborg biaya nyebrang 5 rborg pulang pergi pulau tengah danau nyewa perahu keliling 20 rbsepuasnya lumayan lah
4,tempat hiburan gratismurah meriah hematseandainya dikelola dgn baik warga sekitarbisa menambah pemasukan lbh rapih penataan nya
4,tempat rekreasi baru dipalembang ni kolam renang sekaligus buat acara emak2 arisan karna karokean
4,bantaran kali yg adem asri hebat pemkot madiun mampu mengubah bantaran sungai menjadi tempat wisata warga yg sejuk asri rindang selalu ramai dg kunjungan warga utk ngumpul ngumpul
4,tempatnya bagus masuk cuman bayar parkir motor 3000 htm masuk kolam renang 15000 beda kalo pendamping antrian makanminum kurang puas terlalu lama menunggu kalo misal karyawannya ditambah enaktapi good lah
4,quite a unique experience a good park to learn and see the culture of indonesia especially that of traditional house designs of various tribesregions kids would love exploring this park the place isnt that clean be aware of bugs and mosquitoes though entry is free you can contribute voluntarily for the maintenance cost of the park recommend to visit towards morning or evening when sun isnt there and weather isnt very hot
4,cocok buat liburan ma keluarga anak anak happy sekarang tembakan busanya
4,selesai proses finishing nya perlu kesabaran lebih utk menikmati indahnya laut lhokseumawe semoga pihak pemko segera merampungkannya termasuk tempat parkir yg tersedia
4,kali pertama masuk hutan ternyata didalamnya sangat asri menarik
4,salah satu tempat bagus menikmati sunset view kota manado spektakuler berada perbukitan dgn jarak 30 menit dr kota manado tempat cocok foto ngopi sembari menyejukan mata pemandangan 360 derajat kota manado waktu yg pas sore menjelang malam bs mendapatkan 2 view sunset malam biaya masuk sebesar rp 10000 per orang makanan cafe makatete makanan ringan beberapa makanan berat nasi goreng mie bubur manado cocok kunjungan keluarga rombongan pasangan 2x kesini tetap enak bagus
4,view oke banget udara sejuk kebetulan pas kesana hujan akses kesana jalanan sedikit berbatu jalanan cukup 1 mobil parkir sangat murah menuju cafe yg bawah jalanan sangat curam turunan
4,wahana anak sangat kurang hampir harga tiket dibayarkan disuguhi tontonan paralayang spot foto taman semoga kedepan ditambah wahana anak gratis
4,binatangnya sepi kondisi habitatnya kurang dibenahi
4,taman kota berada tepat depan umm kampus 1 dekat taman spbu taman mampu memberi kesan sejuk jalan bandung terkenal kepadatan dikarenakan terdapat 3 madrasah min1 mts1 man3 malang merupakan jalan menuju matos um ub taman sangat cantik diliat pagi sore hari perawatan rutin dilakukan pihak terkait taman cukup asri menjadi salah taman menghijaukan kota malang
4,salah satu tempat olahraga pagi kuliner minggunya recommended bawa keluarga maupun olahraga sepakbola bersama rekan
4,lokasi dekat kota ngga perlu pusing bawa makanan disana banyak sekali jual berbagai macam makanan kalau air surut anak bermain lebih leluasa dipinggir pantai
4,pemandangannya indah cocok wisata bersama keluarga teman kalian berkunjung kesini selalu menjaga kebersihan membuang sampah tempatnya terima kasih
4,pemandangannya magnifico kondisi tempat melihat pemandangannya sangat kurang terawat utk foto2 area free dikenakan biaya bukit melihat teluk jayapura jembatan merah pegunungan yg membentang kesini klo jayapura
4,sore hari cerah menjadi waktu tepat bersantai tepian sungai sudut pandang berbeda jembatan kahayan salah satu ikon terbaik kota palangka raya dapatkan sini ruang terbukanya memang terlalu luas tersedia fasilitas publik layaknya taman sisi jembatan kondisi cukup memadai sekedar bersantai menikmati suasana duduk atas motor memarkirkan mobil tepian menjadi sensasi tersendiri lupa bawa bekal konsumsi warung sederhana tak jauh lokasi cemilan kopi sachet mainstream tersedia menemani
4,saksi gununk sodara pernah aktif d masa lampau sayank mulai banyak sampah plastik perawatan fasilitas yg terutama toilet
4,affordable swimming pool for your family you can buy food and drinks here with reasonable price or you can bring your own the place might need some maintenance here and there but its tolerable its not as good as the expensive one but its worth the money
4,ditetapkannya lubuk sukon desa wisata bukan alasan desa berpenduduk 200 kepala keluarga kk tersebut menjaga kearifan lokal wujud hunian desa wisata diluncurkan 2013 lama diwacanakan mengingat keberadaan rumah tradisional semakin langka konon perkampungannya kini warga setempat menawarkan homestay merasakan atmosfer perkampungan aceh
4,dairyland is recommended good experience for kids ensure its on good weather though since mainly outdoor activity good dairy product weekday is great for less crowded having a topup card upfront ready is handy too
4,tempatnya mengandung sejarah sangat cantik suasananya tempatnya disalahgunakan oknumoknum tertentu
4,pemandian dg air alami sejuk udaranya meski datang jam 12 siang kolam anak maupun dewasa wahana airnya naik kapal bebek kasih makan monyet hati hati barang bawaan yaa takut disaut sama monyet
4,salah satu janjang indonesia tangga bersejarah kota bukittinggi terletak jauh bangunan ikonnya bukittinggi jam gadang tepatnya berada sebelah kanan menghadap pasa ateh arah jam gadang janjang punya sensari tersendiri menaiki menuruninya sensasi tersebut sembari kaki menaikimenuruni janjang matapun dimanjakan pelbagai barang dagangan dipajang sana aksesoris sepatu sandal kaca mata baju kaos maupun aneka makanan mie ayam bakso jadi kalau berjalan sini pintarpintar menyelaraskan kaki mata guys jangan ulah mata melirik kemanamana kakipun hilang pijakannya guys mau kan oke pernah sini sila datang nikmati sensasinya
4,kalo cuacanya mendukung adem banget disini sejuk pas kemarin kesana hujan jadi becek jalannya pengambilan foto vidio jadi jelek
4,jogya malioborodi sorong taman sorong city salah satu alternatif tempat santai buat keluarga
4,tempat tepat buat lari pagi jalan cepat terletak area perumahan warga kawasannya cukup eksklusif lalu lintas disini cukup sepi aman berolahraga jalan bersama anakanabul
4,peangkaran rusa yg mungkin banyak yg tau akses kesini gampang kok rusanya nakal hehehe overall aman tempatnya luas banyak spot foto bagus disarankan beli makanan rusa dulu masuk jangan pake sepatu putih becek xixixi
4,taman terletak dekat area rumah susun perkampungan warga terdapat satu lapangan futsal lapangan basket rumput sintetis lapangan futsal terawat baik beberapa fasilitas pendukungnya pagar gawang garis batas permainan lapangan basket terdapat beberapa retakan bocel lantai lapangan air sedikit menggenang lapangan fasilitas playing ground anak tersedia terdapat beberapa alat menjaga kebugaran taman taman dilengkapi jalur berjalan atas batu2 pijat refleksi kaki biasanya dimanfaatkan lansia toilet tersedia taman termasuk menggunakan kursi roda area parkir kendaraan cukup terbatas roda empat lebih pas pengguna sepeda sepeda motor meskipun terletak samping jalan trotoar taman tersedia umum taman cocok semua usia anakanak hingga lansia menikmati pagi sore malam
4,tempat memperlihatkan hamparan air pulau tengah perairan hutan dibelakangnya matahati terbit terbenam dilihat lokasi matahari terbit lebih bagus pemandangannya sampah sangat jelas memberi warna kusam tempat tempat umum baiknya sama sama paham pengunjung sebaiknya membuang sampah tempatnya
4,parkir kendaraan tersedia banyak pondok tempat bersantai spot foto pengunjungnya ramai
4,menuju curug parkiran kurang lebih 20 menit jalan kaki lewat hutan persawahan seru sih tp siapkan fisikmu
4,semoga tetap terjaga kelestarian cagar budaya
4,banyak sarana mainan anak2 yg rusak tempatnya nyaman
4,the statue is hardly visible and doesnt seem to pose a significant history
4,rekomendasi kebun teh bagus seger area karisidenan kediri lokasi kebun teh sirah kencong blitar timur jadi jauh dr pusat kota blitar suasana seger sejuk adem menyenangkan refresh mata liht ijo ijo kebun teh air terjun yg satu lokasi dg kebun teh fasilitas makin lengkap mushola toilet spot hunting foto pos penjagaan warung lokasi camping atv hingga glamping menginap htm per org 10k motor 5k tarif tersebut per maret 2024 berubah tarifnya sewaktuwaktu sesuai kebijakan kalau kesini jangan pas weekend kamu suka keramaian soalnya ramai sekali akses jalan cukup mudah dibanding sebelumnya mobil lokasi kemaren lewat wlingi kawedanan lurus aja tembusan langsung pabrik greenfield jalannya meski yg berlubang cukup enak dilewati jalan kurang tahu sih yg via gandusari soalnya gragal2 ga tau kalau sekarang
4,danau alami dekat cirebon dipakai renang tetep jernih dasarnya bebatuan ngeri karna salah satu pengunjung melihat ular dibalik bebatuan  udara nya sedingin pegunungan mungkin karna musim panas harga tiket bersahabat 20k at all okelah buat healing tipis2
4,tempat merupakan satu2 nya pemandian air panas pulau ambon 2 kolam utama pertama dekat mata air alaminya kedua dialirkan kolam mirip kolam renang tempatnya buka 24 jam jadi kalian kesini kapan aja kebanyakan orang datang kesini malam hari kalau ditambah kondisi hujan suasanya makin nyaman disekitar banyak penjual makanan minuman jadi memang komplit wisata cuman mungkin penitipan barang diharuskan mengawasi barang2 bawaan sendiri beberapa bagian kalau dibuat lebih rapih ubin mungkin bakal terlihat lebih bagus modern tempatnya lokasi sekitarnya sendiri cukup bersih air panasnya bau belerang jadi nyaman sebaiknya datang kesini jangan weekend hari libur bakal rame banget sayang maksimal rileks nya terlalu ramai
4,makan dipojokan kucingan tugu kota cilegon enak bercengkrama banyak pilihan satenya cuman nasi kucingnya terbatas
4,tempat nya keren estetik kurang bersih akses masuknya susah kalo udah sampe lokasi jangan ekspetasi besar besar biar puas nikmatinnya
4,kalo tanjung pinang jangan lupa patung seribu sekali tempatnya bagus bersih buat foto keren kalo sini jangan lupa pake sunscreen bawa payung soalnya panas banget membawa disana sediain payung yg pinjamsewa harga tiket masuknya murah loh worth it sih sekian
4,tempat asri nyaman rindang pimpinan desa pemerintahan kiranya perlu ditambah fasilitas toilet sudut bermain anak mini agrowisata menjadi daya tarik kediri
4,tempat sangat bagus kebun kopi hingga kini aktif lingkungan peninggalan belandanya sangat kental sangat cocok tempat wisata sekaligus tempat belajar sejarah keberadaan orangorang belanda terutama wilayah blitar mempertahankan gaya klasik hindiabelanda menjadi daya tarik sendiri tempatnya sangat bersih cukup sejuk meskipun siang sangat terik panas matahari menyengat disini digunakan tempat berkemah disediakan tempat lapangan cukup luas jadi rombongan berencana berkemah membuat gathering sangat cocok
4,budaya empat negara satu tempat ornamenornamen terkenal negaranegara tersebut indonesia cina korea jepang wahana asia heritage 1 floating market 2 great wall china town 3 jeju village indonesia china wisatawan pengunjung menemukan kawasan bernuansa korea asia heritage datang jeju village rumahrumah adat khas jeju berbentuk jamur bangunannya terlihat menarik dibuat batu hitam ditata atap daun tebu wisatawan pengunjung menyewa hanbok baju khas korea 4 little kyoto little kyoto membuat wisatawan pengunjung seakan berada negara sakura jepang terdapat sebuah bangunan tinggi beberapa lantai sangat menonjol lengkap aksesorisnya memakai kimono kawasan little kyoto menambah kesan berada jepang suasana cukup instagramable cocok diabadikan lewat foto maupun video 5 forbidden forest asia heritage menawarkan wahana baru diberi nama forbidden forest sana wisatawan pengunjung menjelajahi hutan tempat berkumpulnya replika dinosaurus trex lainnya berkunjung forbidden forest mengenal berbagai jenis dinosaurus dinosaurus tersebut dibuat bentuk patung bergerak mirip aslinya 6 rainbow slide seram membuat penasaran rainbow slide dikenal wahana paling menarik perhatian rainbow slide merupakan wahana perosotan warnawarna sangat tinggi tarif masuk asia heritage rp 30000orang tarif tersebut termasuk fasilitas welcome drink gratis akses masuk 4 area negara pengunjung mencoba wahana sini dikenakan tiket terusan sebesar rp 50000orang tiket terusan tersebut digunakan menjajal wahana dino jungle naik kapal kereta wisata museum 3d rainbow slide
4,tempat kumpul belajar pembiakan madu murni trigona toop
4,nice experience with plenty of places to visit and take photos the food is not varied because some restaurants are closed the ticket is reasonable but you need to pay again for some places like transportation to pintu langit and kids zone parking quite large
4,bagus menarik alun alun nya disediakan tempat parkir mobil miniatur candi playground toilet dekat masjid tempat kuliner banyak kursi menikmati suasana alun alun
4,bagus si tempatnya cocok buat anak kecil banyak sewa sepeda baik listrik ataupun ngga cuma pas kesini kotor cuma bagus si suasananya makanan jajan terjangkau self foto cuma sayangnya ga cetak lokasi
4,taman wisata paling bersih lesehan harga terjangkau rasa mantap menu biasa rasa juara cocok keluarga varian makanan paling penting toiletnya bersih kolam ikan bersih semoga kolam renang dikelola baik
