Rating,Review
2,cukup sekali berkunjung kesini akses jalan menuju wisata rapi berantakan tanah batu2 banyak pungli ampun dehh greget banget bayar tiket masuk 2x coy padahal pintu masuk yg pertama terpampang jelas bacaannya pintu masuk wisata rusa ternyata eh ternyata cuma buat tiket jembatan aja yg terbuat kayu beda kalo mau lihat rusanya harusnya awal aja dibilangindikasih petunjuk kalo pintu sebenarnya resmi dibuka harusnya gak perlu bayar lg laah kaget mau puter balik udh perjalanan jauh petugas disana banyak beralasan entah petugas ato org kampung situ lucu lg mah parkirnya dipintu masuk pertama tiket jembatan kayu udah dimintain buat tiket motor 5k otomatis mikirnya udh include parkir dong eh pas mau pulang dimintain uang lg katanya uang tunggu lah kocaaakkk tempat wisatanya rapi berantakan rusanya ge dikira banyak ternyata cuma 45 ekor aja jembatan penhalang pagarnya gak benerin ato coba dirapihin gitu biar estetik ceunah tips berkunjung 1 pake sepatu casual jangan pake sendal 2 bawa payungtopi karna bakal panas 3 bawa makanan dr rumah yg buanyaaak tp kalo mau beli tempat wisata warungwarung tersedia 4 point penting pintu masuknya jangan lewat jembatan kayu langsung jembatan besi aja letaknya parkiran mobil langsung ambil kiri gapuragerbang masuk gtu kaya belom dibukaketutup gitu menghemat bayar tiketnya lumayan sekian semoga kunjungan sia sia hahahahaha
2,akses lokasi lewat perumahan warga petunjuk jalan raya banner kecil berkunjung sini hari minggu dikenakan parkir sama tiket masuk 10k kalo siang panas sama sekali ga peneduh sekalipun tempat sampah tetap banyak sampah berserakan beberapa anak warga yg bermain area omongannya kotor semua muara mundu area zona wisata mangrove kasih sayang akses jalannya lewat pemukiman warga rebutan sama kambing yg buang kotoran sembarangan banyak yg becek hati2 biar ga kena zonk penunjuk jalan seadanya perlu diperbaiki dikelola lebih baik baru dibuka wisata
2,tempatnya sepi tdk terawatcoba klo diberi perubahan sedikit pd tampilan depan terutama jln masuk diberesin mungkin banyak pengunjungnysa
2,akses lokasi lewat perumahan warga petunjuk jalan raya banner kecil berkunjung sini hari minggu dikenakan parkir sama tiket masuk 10k kalo siang panas sama sekali ga peneduh sekalipun tempat sampah tetap banyak sampah berserakan beberapa anak warga yg bermain area omongannya kotor semua muara mundu area zona wisata mangrove kasih sayang akses jalannya lewat pemukiman warga rebutan sama kambing yg buang kotoran sembarangan banyak yg becek hati2 biar ga kena zonk penunjuk jalan seadanya perlu diperbaiki dikelola lebih baik baru dibuka wisata
2,awal berkunjung tempat awal awal buka23 tahun yg lalubagusbersihbanyak wahana murahlalu kmarin coba main sini lagikondisi banyak berubahsepikosong beberapa keluargatempat sangat terawatcenderung terbengkalaikolam renang anak penuh lumutlicin berbahayayang paling ga sregtiket masuknya dulu free sekarang 20rb per orangmasuk wahana bayar lagimakan minum mahal lahhhh ketebak bakal gimana
2,cagar budaya kondisinya memprihatinkan terawat kebersihan fasilitas sangat disayangkan simbol negara turun mempugar pantas pengunjung datang diantar mas irwan guide lokal musium dibukakan langsung adiknya sultan 
2,bintang 2 aja mudah mudahan berbenah minus akses jalannya rusakkurang bagus fasilitas kurang terawat sedikit kotor kurang maintenance parkir bayar kamar mandi bayar 2000 tiket masuk relatif mahal 20000orang wahanafasilitas jatuh nya relatif mahal bayar parkir kamar mandi berbayar saran aja harga nya diturunkan sedikit kurang worth it kalo soal harga fasilitas lainnya lebih diperhatikan tiket fisik enggak dikasih jadi cuma bayar tanda terima pembayaran memang biasa kertas tiket masuk kayaknya masuk kantong pribadi jaga aja  kalau pakai tiket masuk tempat wisata kan rapi enak diliatnya sederhana lebih baik berbenah plus air nya jernih benar benar asri enak buat berenang buat suka berenang sensasi nya beda bener bener alami kesimpulan tetap rekomen sih sesekali berkunjung kesini air nya benar benar bersih semoga masukin diperhatikan berbenah
2,biaya masuk 15rborang biaya parkir mobil 5rb motor 3rb spot foto berbayar 5rb khusus ayunan 8rborang foto pake jasa fotografer biayanya 10rb per3 foto bentuk soft file dikirim lewat bluetooth quick share wa biaya sewa gazebo 50rb harga pakan ikan besar 10rb kecil 3rb 5rb dapet 2 tiap masuk wc bayar 2rb harga jajanannya standar sih contoh lemineral size 600ml harganya 6rb jujur aku biaya masuk 15rb tuh gak worth it pengunjung gak dapet apaapa free cuma terapi ikan doang soalnya kesini kan mostly mau foto naah sebenernya gapapa banget kalo beberapa spot bayar jadi kaya bayar 15rb diawal buat apa pengunjung dapet apa mau berenang gabisa mungkin jadi buat biaya pengelolaan apa idk but aku pov pengunjung tetep ga worth it sorry to say ya
2,kondisi kolam nilai 7510 point plus segi airnya jernih segi fasilitas perosotan dekat wc wanita nilai 210 dikarenakan safety nya kurang berdekatam sama listrik ngg pembatas takut anak kecil masuk kedalamnya perosotan miniatur kapal nilai 510 ujung kolam berada kanan ngg ngotak jadi bakalan kebentur kalo pake perosotan mushola kalian liat sendiri aja nilai 610 katakan kolam tahap perkembangan beta semoga kedepannya diperbaiki liat kolam sukapura dadaha disitu harganya 14k fasilitas nya oke
2,taraju obyek wisata indah disana disediakan tempat ber foto stage kuliner minuman pemandangan cukup asri begraund perkebunan teh menghampar hijau bak permadanitapi sayang area kurang puas sarana mck musholatidak disediakan 
2,jalan menuju wisata cukup kecil berlubang jalan utama pagerageungnya sendiri kurang lebih 2 km  tiket masuknya 20 ribu termasuk parkir dikasih air mineral cleo 220 ml harga segini sebanding pengalaman fasilitas diberikan jadi harganya kemahalan pengunjung  titik tujuan naik menanjak atas pakai kendaraan atas tempat parkir sangat terbatas tentunya  udara sana sejuk sekali cocok buat healing sekedar melepas penat hingar bingar ibukota tempatnya berada puncak bukit  sayangnya kolam berenang sini kurang keurus terlihat warna air kolamnya keruh kolam berenang dewasanya banyak dedaunan  beberapa spot foto rapuh bahkan beberapa udah pakai kerucut lalu lintas orange pertanda jangan dilewati tetap terlihat beberapa orang berfoto situ petugas menjaga semakin membahayakan pengunjung  terdapat masjid almahmud aktif digunakan kegiatan anakanak pesantren gitu  beberapa villa terjaga disewa  tempat wisata kadang sering digunakan kegiatan perkemahan kegiatan orientasi sekolahsekolah saran semoga pengelola lebih memperhatikan keamanan pengunjung beberapa spot foto rapuh berbahaya dijaga bahkan diperbaiki harga 20 ribu tiket masuk termasuk kemahalan dibanding apa didapat selama berkunjung sini terima kasih
2,pengendara mobil hati2 jalan kecil sangat menanjak cenderung berbahaya mobil keluarga direkomendasikan mobil
2,tempat nya sepertinya kurang terawat airnya entah berasa lengket kulit rasanya lengket kalau habis pegang minyak goreng trus siram air airnya aroma kaporit spt kolam renang umumnya
2,bagus nggajelek nggacuma klo mau wisata kayaknya kurang pasjd jiga ngopi gigiren balong we judul na mahsepi pengunjung
2,masjidnya bagus luas masjid agung kota padahal parkir mobilnya tertata ruang kurang tau dulu perencanaannya gimana kamar mandi bayar krn yg nungguin asli pengalaman pertama satu2 nya kayaknya toilet masjid yg bayar sekelas mushola masjid kampung aja gak bayar wajar kalo kotak amalnya tp kalo yg nungguin jd bertanya2 legal penjaganya plis banget siapapun pengurus resmi masjid lebih diperhatikan aku yakin org tasik gak pelit kok cuman pemanfaatan kotak amalnya semoga dikelola bijak sesuai kebutuhan masjid meski toilet bayat kurang bersih lho lantai berbau kalopun gak wangi gpp sampe berbau huhu semoga komentar orang2 sini diperhatikan dipertimbangkan yg berwenang terimakasih
2,tempat nya sepertinya kurang terawat airnya entah berasa lengket kulit rasanya lengket kalau habis pegang minyak goreng trus siram air airnya aroma kaporit spt kolam renang umumnya
2,murah jorok kamar bilas pintu nya rusak semua kolamnya buat anak kurang perhatian pengawas masa pengunjung dibiarkan makan dipinggir kolam
2,lokasi gak terlalu jauh kota tempat parkir mobil motor lumayan luas masuk lokasi warungwarung jualan kopi indomie nasi liwet kelapa muda retribusi masuk rp 3000 perorang suka foto disini lumayan biaya masuk terjangkau menikmati pemadangan indah atas bagusnya kesini sore matahari terbenam hasil foto keren sayangnya tempat banyak sampah beberapa tempat sepertinya bekas bakaran jadi sisa bekas bakaran hitam mungkin dikarenakan biaya retribusi terbilang murah makanya gak kurang penjagaan kebersihan bukan tempat foto tempat makan pengunjung makan saung disana
2,beberapa minggu yg lalu kesini cuma udah ga lg objek wisatanya sepi kotor terawat sangat disayangkan
2,gersang panas byk sampah berserakan terurus sebaiknya segera dibenahi byk pengunjung
2,kalau berharap healing menikmati suasana yg sunyi damai tentram salah tempat tp kalau arisan bersama teman2 sebaya makan bersama karaoke disini tempatnya maaf orang2 yg mencari ketenangan disini bukan tempat yg cocok
2,akses menuju lokasi penuh perjuangan sempat menginap dikarenakan pertimbangan btw nice view atas gunung
2,minum air kelapa muda segar makan dagingnya tepi pantai merasakan angin pantai melihat batu besar diterpa ombak sungguh mempesona peringatan dilarang keras berenang pantai banyak mati sayang banyak bangunan liar tepi pantai ditutupi terpal warna biru membuat pantai menjadi kumuh bekalangan baru tau kalau bangunan disewakan pengunjung mengerti apa enaknya pantai menyewa bangunan tarif parkir mobil 20000
2,kurang rekomen tempatnya kurang terawat jalannya licin banyak fasilitas yg rusak sebaiknya fasilitas diperbaiki sebanding dgn biaya tiket masuk parkir
2,terakhir pas dilangen tulisan alun alun nya udah kurangcuman alun alun langenarijadi s nya g btw kebnykan tarik uang klo g ikut bebersih denda 10rbsedangkan cari uang 10 rb susah sehari uang 10rbditambah lagian lingkungan sama gak bersihjadi sy jualan bebersih
2,parkir mobil 5rb tiket masuk bukit 15rb 2 tempat summer hill rainbow rainbow gak masuk udh capek soalnya  buat tiket masuk summer hill renang 15rb terusan 30rb bawa makan saran buat pengelola berinovasi biar membosankan misalnya air mancur apalah air yg semprot jangan pelit air pompa ayo berwisata lokal gaess 
2,keterangan buka nya jam 8 kenyataan buka jam 9 itupun yg dalem persiapan sama sekali kolam renang isi air makanan buka jam 10 an luntang lantung ga jelas bukit kayu putih
2,candi hindu gunung penanggunganpengunjung datang kebanyakan punya hajat konon air sucinya dianggap memiliki energai penyembuhan cocok buat rekreasi foto 10 des 23 tiket masuk rp 10 korg resmi parkir mobil rp10 k resmi terkesan memalak tukang parkir yg kurang simpatik
2,fasilitas kurang terawat banyak outbound tp gk safety nya gak petugas nya tdk aman utk anak anak paling yg bs dipakai cuma kolam renang aja air terjun nya tdk rekomendasikan jalan kesana tdk amantdk jalan setapak akhir jadi jalan nya tanah lempung licin sebelah nya lgsg jurang suami sdh pleset 2x akhirnya mengurungkan niat air terjun khawatir jalan yg tdk memadai jd sy tdk aman utk anak anak termasuk orang dewasa
2,bagus banyak spot terlebih foto selfiair terjunnya jauh info 500 mtr real mya 5km analhamdulillah turun nya pakai ojek aja mantap
2,minggu pagi jam set 10 kesini 2 kolom air panas terisi kosong 1 kolom kosong terdapat bangkai laron dibersihkan airnya kurang panas sayang tempat sebagus pemeliharaan kurang baik
2,lumayan lah meski dikelilingi hijau hijau tp panas fasilitas mck mungkin bebenah krn pas kesini musim hujan so air sungainya keruhapa memang begini n alirannya deras next moga jadi wisata yg rekomen
2,kesini bawa rombongan potongan harga tiket biro wisata tempat sejuk terlihat sangat terawat banyak lumut banyak pedagang ngikutin terus nawarin dagangan jadi mengganggu kenyamanan pengunjung harga tiket 20ribu sebanding pemandangan dapatkan mahal layak tempat sepi terkesan horor diperbaiki
2,the entrance fee is so expensive 20000 rupiah per person with nothing we can do no activity can be done though it was sunday there is atv station where i can see two cars parked there but no staff was there all i can see was only men trying to persuade us to ride horses 50000 rupiah for 15 min 100000 rupiah for 30 min ride and women trying to persuade us to sit and drink at their place photo spots just left untreated so so bad there is a quite big pool for people who wants to swim but you must pay some more money
2,cuman kemahalan permainan ank ank nya bos baru maen sebentar ko 10 ksuruh bayar es teh nya manis sih tempat cocok buat pacaran terus 
2,klo nginep sahid mandarin gratis masuknya cuman airnya ijo
2,cuman kemahalan permainan ank ank nya bos baru maen sebentar ko 10 ksuruh bayar es teh nya manis sih tempat cocok buat pacaran terus 
2,pantai nya bugs guys cm akses jlnnya hrus prbaiqi lgi
2,pantai nya bugs guys cm akses jlnnya hrus prbaiqi lgi
2,kemarin habis kesini sama suamiku pengen liburan gue suka sama pemandangan nya bagus lah buat ukuran wisata adem yg jaga tiket ramah yg jadi masalah waktu pesen makanan super lama banget padahal gue pesen jam 1145 makanan tug baru tiba 1402 an gilaaa bete banget kebayang nahan lapar gimana plis tingkatin dong pelayanan nya
2,tempat nyaman bersantai keluarga tema alam efek pandemi covid19 tempat ditutup sepi
2,kolam renang lumayan bagus event kejuaraan sayang fasikitas lainnya buruk tempat bilas bayar air gak
2,tempatnya kotor campur sama pasar bukan buat rekreasi karya wisata nothing u can do here kalo mo belanja
2,sangat sanyangkan tempat sebagus terawat terbengkalai beroperasi mungkin akses lokasi lumayan efort beberapa spot jalan rusak kurang mendapat perhatian pemerintah
2,lokasi yg tepat bantaran sungai jadi sangat rawan terutama hujan banjir longsor sangat diwaspadai disarankan anak anak lansia pengawasan sedang maintenance semoga kedepan manfaat bermacam kegiatan
2,patung gesang sang maestro keroncong tpt sejuk byk pohon besar cm krg terawat
2,pertama kali datang sangat bagus kedua kalinya ternyata tahap renovasi semoga lebih bagus sayangkan pegawai perkir provesional mengatakan parkir area depan ternyata banyak mobil parkir jalan jauh
2,reservasi nya yg retail selalu kalah yg sewa menanyakannya jauh2 hari dijawab open reservasi tiap hari senin hari senin pagi2 ditanyakan jawabnya disewa dlm 1hari mending usah buka reservasi umum kalo kalah terus sama yg sistem sewa bikin kecewa
2,sorry to say yg menarik duduk kursi tingkat 2 bus penumpang berebutan duduk diatas alhasil bertukar tempat waktu rute balik walaupun sebagian tetap mau gantian kursi bus kotor sebagian kondisinya rusak sandaran ditegakkan banyak sampah sela2 kursi didalam banyak nyamuk  pemandu kurang komunikatif penjelasan singkat bangunan bersejarah sepanjang jl slamet riyadi pasar besar sisanya diam memegang mic bahkan info berhenti toko oleh2 baik mempersilahkan penumpang turun maupun durasi berhentinya sangat disayangkan berhenti toko oleh2 batikbaju yg durasinya terlalu lama penumpang anak2 sebagian besar bosan mainan lantai bus anakku merengek minta pulang menikmati sepanjang rute balik sungguh disayangkan jadi perjalanan yg membosankan seru buat anak2 semoga kedepannya lebih baik lg
2,mahal euy tiket masuk nya mending ragunan tiket masuk cuma 4rb dewasa anak 3rb kalau cuma mau lht hewan mah
2,penghijauan coba kasih pohon yg bs brmanfaat sprti buahan kalo skarang tanaman skitar bikin serem sungaikali nya jg butuh peremajaan tdk sprti parit
2,fort vastenburg merupakan benteng peninggalan penjajah belanda kota solo benteng dibangun sejak abad 18 kemarin kesana benteng ditutup masuk sepertinya sekarang benteng sering sibuat tempat pertunjukan konser2 benteng letaknya jauh pasar gede solo jalan kaki 400m sayangnya sepertinya kurang terawat banyak sampah dimana2 sayang sekali padahal harusnya peninggalan sejarah dirawat dijaga
2,fort vastenburg merupakan benteng peninggalan penjajah belanda kota solo benteng dibangun sejak abad 18 kemarin kesana benteng ditutup masuk sepertinya sekarang benteng sering sibuat tempat pertunjukan konser2 benteng letaknya jauh pasar gede solo jalan kaki 400m sayangnya sepertinya kurang terawat banyak sampah dimana2 sayang sekali padahal harusnya peninggalan sejarah dirawat dijaga
2,datang hari sabtu pukul 0800 sesuai jam buka harapan ramai ternyata jam buka disertai kesiapan karysaat ditanya mau pakai perosotannya aer blm nyala alasan kary menunggu ramai karyawan jawabnya menunggu kary yg ngurusin datang profesional sekalimenulus jam buka kesiapan kalo ga rame berarti wahana tdk dioperasikan sangat kecewakita datang bayar kok diminta nunggu rame make perosotannya aer nya dipake
2,letaknya bagian depan objek wisata pantai alam indah sayang terawat gedungnya udah tutup terlihar beberapa anak kecil datang melihatlihat alat transportasi dipajang
2,dulu awal dibangun rapi bersih terawat tp sekarang kotor terawat padahal jadi sarana edukasi anakanak sembari duduk santai menikmati masakan cemilan dijual pai lebih baik museum nya dioperasikan
2,banyak sampahnya terawat pantainya mungkin kolam renangnya bersih tempat kolam renang kondisinya memprihatinkan sangatlah kotor bahkan banyak sekali sampah plastik sampah mikroplastik butiran sampah plastik kecil pantai mungkin lah semakin sedikit pengunjung mendatangi tempat harga makanan minuman entah harganya cukup mahal
2,baru tadi siang situ karna liat rekomendasi google pas aku lokasi mungkin musim panas jadi gersang airnya sedikit ga aku pikirkan htm 10k gtw sebenarnya gratis emg bayar karna waktu orang jaga warung disitu datang nyamperin langsung tanya orang mana mba pas aku bilang kota lngsng bilang biaya parkir 10k mungkin kalo bilang orang free tp gatau jg si htm 10k pemandangan panas bgt gersang kecewa karna melihat bebatuan debu angin lumayan kencang bgt nilai positif nya bapak bapak nya ramah tp orang minta htm muncul pas dateng doang pas mau pulang orangnya gada mungkin sembunyi warung karna panas warungnya cuma satu bawa masker air minum karna kering bgt lingkungan nya banyak debu dri truck jg kalo pikir mau kesitu keknya next aja deh eheheh
2,terlalu kotor terawat mahal masuknya berbeda jauh pantai2 arah timur klo arah timur pantainya berdih bener2 terawat pengunjungnya rajin membuang sampah tempat sampah
2,menyedihkan rumah khas kabupaten kota jateng nampak tak terawat jamur tumbuh dimanamana sayang sekali mestinya kalau lebih jalannya berwarna banyak hiasan nampak lebih menarik rumput tinggi mendominasi sungai kecil nampak airnya keruh menggenang bersampah jam 7 buka loketnya sepi bapak yg duduk nampak tak berseragam nampak sibuk berkegiatan sendiri mengabaikan pengunjung yg datang lumina sama bersih jalannya bangunan tempat duduk nampak tak terawat mau sewa baju buat foto tak yg buka penjual makanan area tutup semua padahal harga tiket masuknya kan sama ntah datang pagi petang apa yg didapati berbeda datang waktu pagi mau naik kapal keliling danau katanya dibook rombongan akhirnya menunggu sebenarnya seat kapal tersebut 2 orang anak akhirnya naik bebekan dikasih kebebasan waktu sepi makasih buat mas yg jaga tak berseragam minimal berusaha ramah jam 9 akhirnya anak berusia 8 th pulang penuh kekecewaan komidi putar 3d cinema goulf sewa baju tak yg buka science center masuk sendiri petugas ruangan garing pencahayaan pengaturan suhu yg memadai mana sebagian besar alat demonya rusak tak digunakan jalan halte brt loket lumayan jauh tak dufan yg shuttle halte transjakarta halte prpp akses gate grand maerakaca tak pedestarian yg aman pejalan kaki jadi berbagi mobil bahkan terpaksa jalan tengah melewati mobil yg ngetem sisi jalan dibawah flyover bandara sebenarnya pengen ngasih skor 1 bintang mau tambahkan 1 bintang khusus 1 staf gate keluar bernama mbak alif kebetulan namanya mirip nama anak alifya yg mau mengantar anak yg kelelahan berjalan gate halte brt terdekat semoga mbaknya senantiasa sehat bahagia
2,salah satu objek wisata menarik akses menuju lokasi terawat krn jalanan yg rusak nyaman dilalui sangat disarankan berkunjung musim hujan
2,semakin kesini kok wisata dirawatkolam renang kotor bangettrus tempat duduk area pancing ikan anak kotor banyak banget kotoran burungnyapokoknya sekarang wisata taman lele bagusharus terus benahidemi kenyamanan pengunjungnya
2,tempatnya luas rindang banyak pohon besar sekitaran tempat parkir luas banyak warung makan bangunannya terawat baik atap bangunan mulai terlihat kerusakan dibiarkan sangat disayangkan
2,ambil foto tanggal 06 januari 2022 taman wilis mungkin terlalu populer melihat lokasinya tersembunyi jalanan umum lingkungannya cocok sekedar bersepeda maupun berolahraga pagi pemandangannya bagus bertemu sunrise dimalam hari disuguhkan pemandangan kota semarang sana ternyata terakhir kesana kondisinya sangat jelek terawat kotor urungkan niat sekedar nongkrong disana pihak terkait membaca ulasan menata ulang taman wilis menjadi lebih layak
2,ga jadi masuk krn terbengkalai terawat padahal dulu bagus dulu sempat ramai media katanya mau dibikin jateng valley jateng park sampe sekarang kok ga kabar apa cuma buat bahan kampanye sangat disayangkan tempat wisata bagus sekarang mangkrak padahal potensi wisatanya besar
2,grand maerakaca merupakan tempat replika berbagai bangunan daerah jawa tengah sayang banyak terbengkalai menjadi rusak kurang perawatan
2,kurang terawat kotor banyak rusak trek kayunya
2,maerokoco semarang salah satu menjadikan namanya tmii semarang kondisi kunjungan terakhir sangatlah mengecewakan terawat sangatlah sepi pengunjung harap dikembangkan mengadakan event menarik pengunjung keindahan kebersihan ditingkatkan
2,overall bagus fasilitas fasilitas penunjang wifi tempat terdapat steaker listrik colokan listrik
2,kebayang bagus pengadaan barang butuh biaya murah mendatangkan badan pesawat pas datang kondisi butuh perawatan lebih terlihat lebih bersih hannya lihat ijo ojo daun bikin adem
2,pemandangan sangat bagus terletak tepi sungai pembelian menggunakan keping tertentu sangat tepat alangkah baiknya terikat keping kelihatan perbedaannya tepat lebih baik menggunakan transaksi nilai rupiah nya makanan kulinernya cukup bagus banyak gorengan perhatikan kecil tisu musholla parkir toilet sangat sangat bagus
2,sayang sekali tempatnya terbengkalai kotor suasananya jadi horor
2,tempatnya belakang kusuma agro kencana jauh banget kalau jalan kaki malam malam serem bangetkarena akses mobil akses sepeda motor acara bukber bersama teman sekolah disini pesan paketan buat 16 20 orang makanan buat bukber memuaskan menu cm beberapa itupun d jatah teman pesen buat 1 keluarga trnyata jadikan satu sama orderan yanga arisan tempatnya pawon simbok kecil banget banyak orang bersesakan antri mengambil makanan buat buka bahkan segelas teh kopi membeli sendiri minuman panas sama sekali kolak dingin servis karyawan kurang baik perjanjian diawal order 10 paket sdh dp free 1 paket ternyata diakhir jadi berubah 11 paket 1 free sangat profesional not recommended mohon koreksinya mohon perhatiannya buat kepuasan pengunjung
2,pas sini tanggal merah tempatnya bagus eh ternyata tutup padahal enak banget buat ngadem
2,lokasi dekat bns naik dikit belok kanan parkir sangat jauh lokasi spot foto jarus jalan kaki menanjak mau kemah baru diijinkan mobil naik yg kaki gak kuat mending jangan kesini tiket masuk kawasan 15korang tambah parkir 10k bayar jadi 1 tiket masuk lokasi 25korangada paket per spot 2 jatah foto sisanya kalau mau ambil hasil bayar pengunjung lebaran 2024 dikit sebaiknnya toilet dulu toiletnya rusak jorok gak sinyal seluler hp gak berguna disana klau mau kantor minta wifi kapasitas 2mbps
2,overall tempatnya bagus bayar tiket 2 kali parkir motor 5 rb pengeluaran 45 rb worth it sama perjalanan kesana
2,view biasa banyak spot lebih bagus akses lebih mudah titik spot sepadan akses jalan menuju lokasi cukup sekali jalan makadam sepanjang lebih 3 km batu2 disusun beberapa bagian lepas jadi berlubang motor mobil kondisi fit kalau ban bocor nuntun cukup jauh sayangi motor mobil akses mobil gantian kalaun simpangan kanan kiri kebun jeruk kebun jambu
2,1lokasi sangat strategis diexsit tol caruban 2parkir lumayan luas 3tempat makan tersedia banyak tempat 4makan lumayan enak 5pelayanan cepat 6fasum fasos kurang bersih 7lingkungan kurang diperhatikan
2,pelayanan sangat mengecewakan booking acara kantor leader guide selama acara peserta disuruh cari tahu sendiri keberangkatan rafting selesai rafting makan siang vendor kurang profesional menu makanan request beda disajikan trip raftingnya cukup seru guide perahunya oke2 perlu dibenahi pelayanannya
2,biasa maaf tdk sempat foto krn mobil melewati gang sempit
2,sebuah taman kecil yg ramah anaktempatnya bersih sejuk
2,sorry i had to give this ride 2 out of 5 aside from a really great service from the worker there there isnt any much anything else the ride is boring the robot is broken here and there awkward shooting position not all passenger get a gun needed so much maintence here
2,tried to go yesterday no signs left no markings on where to hike no place to park a motorbike very very tough terrain to drive through from past reviews looks like this place used to be kept up but is not anymore after asking a few locals on the area they said its very hard to get to because theres no signs so you will get lost and it is 3 hour walk one way wish this place was maintained as it looks beautiful
2,gerbangnya kunci masuk candiada nomor telepon dekat gerbangnamun dihubungi selalu callingmohon lebih aktif menerima telpon memberikan jadwal terbaru candi mengupdate nya google maps
2,tiket masuk sendiri foto bayar spotnya kalo fasilitas difotoin pakai slr mungkin gapapa bayar kalo tiket sekali aja uda sama parkir foto sepuasnya rata wisatawan mau ribet yg berkelompok semoga lebih baik jado wisata favorit
2,pengalaman sangat bersejarah berjiarah tempat raja pendiri majapahit
