Rating,Review
1,dont bother the boardwalk is completely broken
1,minim tempah sampah minim nya kesadaran orang buang sampah tempatnya taman jadi kotor bgt banyak ulat bulu 
1,hotel cocok costumer business travelling ac gerah kamar wifi air panas mandi air minum ditaruh air galon dipasang tisu galon membersihkan hello bagaimana minumnya masuk kamar malam hari request breakfast dikirim jam 0630 mau checkout segera bekerja lewat jam 0630 breakfast dikirim telpon receptionist 8 kali mengangkat padahal hotelnya sangat sepi ditanya lobby eh ternyata jam 0630 petugas standbye capek deh hotel petugas pantesan hotel sangat sepi ramainya sama kawanan kera datang jam 0600 pagi terpaksa gerah kamar ac menutup jendela kamar jalan2 pagi kuatir keamanan sekawanan kera datang
1,mampir senin siang sepi sekali naik ojek jalan depan bayar 10k dilokasi pas ketemu yg jaga disilahkan masuk pengunjung pembangunannya benar2 rampung pedagang pertengahan jalan menuju lokasi sempat terpalang kayu2 yg sengaja diletakan penduduk sedikit kesalah pahaman pemerintah pengelola kalo menara tinggi jd objek yg menarik buat lihat kawasan mangrove jd tempat pemantauan akses terbuka baik amenitas perlu diperkuat
1,parkiran kok diluar taman janggal gak lho tanda buat parkiran kok gak dibuat ceroboh banget sore menjelang malam kalau cuma 12 motor kadang parkirnya ga nampak motoran speed 4050 kdg kalau lupa hampir kena
1,mungkin hari kurang bagus buat udah hujan air keruh hujan jalan licin banget ehh malah helm hilang parahh parkiran ga jagain apa gimana
1,salah satu taman ditengah kota tp kurang perhatian pemkot setempat banyak sarana permainan yg layak pakai smoga segera direvitalisi
1,kolam renang nya kotor banget kaya gak pernah diurus pegawai sana kolam renang nya urus
1,cukuik sakali ko sajo kamari 1 wahana 1 kepala wahana oke den manarimo untuak naiak 1 boomboom car mendampingi anak usia 7 tahun bali 2 tiket bia an sajo anak tu sorang anak 7 tahun padiaan naiak sorang jawab petugasnyo mah mah beko baabaa anak urang lai batangguangjawab wahana aneh dimadimanyo tampek wisata ado boomboom car 1 tiket untuak 1 boomboom car tu tiket den campak an dimuko petugas tu bia ilang 30ribu penting hati den sanang masuak lokasi 20ribu perkapalo parkir 10ribu lo ndak masalah den fasilitas kalah lo tampek wisata masuak 5 ribu wc dakek resto ateh jauah wahana mambayie pulo mushalla indak memadai kok ado review bintang nol den agiah mah
1,1layanan sangat ramah lokasi sewa ban yg ibu2 tua pakai kaca mata muka bopeng putih demoul bedaksangat kecewa pelayanan brtanya masalah pompa ban beliau banting2 ban mompa ban sewaan posisi buang muka jelek juteknya membelakangi sayabukan malah mau menyapa banting2 bannya semakin menjadi2terus tanya krna sy pengunjung berhak dong utk brtanya fasilitas keramah tamahanmaaf mbak bs pompa ban dijwabnya bnyak kerjaanoh jd gk bs mbakbukan gk bs mbak ban besar gini lama perasaan deh semua ban besarkalo mau dibayar y mompa y tinggal bilang aja gk usah mau marah2 sm pengunjungsaya pompa sendiri aja mbak bisaaku nih lg sibuk mbaknanti ajajawabnya sambillariterus sy diusirdisana pompa banamit2 deh cabang bayi punya karyawan kayak ginisdh 3 x sy brkunjung kesini si jutek tambah parah juteknyamashaa allahmikir deh kalau mau kesini lg ketemu si jutekpake hijab tp kasarsedih banget rasanya adh bayar mahal2 dimarah2 hnya krna masalah pimpa bangimana mau bnyakpengunjungkalo yg ditemui muka jutex pelayanan kayak gini allahampun deh sangat kecewa sekalisulit banget tuk dimaafkan 2semua wahana harusnya cat ulang biar lebih menarik krena saingan sdh bnyak lohdi tambah lg karyawan ban yg kasar pelayanannya
1,dulu gapernah dibenerin keramiknya uwa sampe jahit kakinya karna luka kena keramik sangat rekomended jgn kesini
1,rumah pohon rusaknggak layak pakaimushollah sama toilet terawat
1,menyengkan segar airnya jernih dingin cogan cogan ganteng
1,as a foreigner you pay 25 000 rupiah 10 000 for the locals and you have no explanations whatsoever at least in the water palace there are many guides who explain stuff and show you around here its just a big empty space the local people get tour guides though
1,kacau parah nyesel bgt kesini udah bayar 20korang parkir 2k tempatnya bener2 ga layak kunjungi udah terbengkalai ga terawat jalan ikutin terus sm penjual makanan disitu bikin risih nyesel bgt 42k ilang sia sia ga dpt apa2 kek serasa pergi tempat horor aja please yg mau kesini mikir 100x deh kacau bgt tempatnya tanggung jawabnya dong yg punya tempatnya kalo ga niat gausah buka deh
1,tempatnya membosankan petugasnya ramah robotnya cacat matanya putus tangannya putus menyeramkan tempatnya rasis benua afrika keretanya lambat mau masuk petugas marah marah jelas lampunya delay
1,menuju kesini jalan nya rusak hati2 naik mobil susah lebih baikenak naik sepeda motorsepeda pancal aja
1,kolam renang satu bulan tutup mainan perlu perawatan tempatnya dekat parkiran jadi kurang terawat
1,kolam kotor gak terawat tempat kotor pnjaga loket pelayanan jutekjudesketus gk jls kurang recomendd orang2 yg mau berlibur merifresh otak makin stres kalao liat pelayanan penjaga loket fasilitas sana
1,tempat wisata keluarga terletak pinggir jalan bukittinggipayakumbuh bangunan kelengkapan terlihat pengembangan dikelola baik petugas jaga loket tiket pintu masuk ramah menganggap pengunjung tamu mendatangkan uang waktu kesini petugas bahkan menipu mengatakan voucher berlaku fasilitasnya terkelola baik kolam renang kotor sarana permainan rusak tenda kotor toilet kurang bersih petugas kemanan staf siap membantu darurat direkomendasikan wisata keluarga bawa anakanak
1,per orang 20rb ga karcisnya jalan rusak banget kalo bawa kendaraan bukan buat offroad siap2 aja deh bawa kenang2an itung2 bayar buat nikmatin wahana jalan rusak gerbang berikutnya misal curug tracking kawah ratu bayar 20rborang kawah ratu parkirnya 10rbmotor ga karcis sepertinya parkir liar
1,curug bangun jalan tol akses jalan curug jadi gampang
1,tempat jelek air butek kuning lumpur parkir susah gak yg jyal makanan wc cuma 1 jorok jalan area taman jelek gak rekomended
1,mantap merebuskan telur waktu 20 menit matang sempurna sayang perubahan luapan air nya
1,sana tanggal 28 des 2018 ternyata pilihan beberapa gedung gedung 1 bayar 10korang isinya pameran lukisan lantai 1 lantai 2 lantai 3 melihat pemandangan tarifnya terlalu mahal yg menarik dilihat gedung 2 bayar 15koranglantai 3 lantai datang sepi sekali mungkin terlalu mahal kurang menarik jadi kurang pengunjung semoga diperbaiki isi biayanya lebih menarik pengunjung
1,umum inilah katakan penjaga taman sangat membingungkan taman negara masyarakat well dasarnya yg nilai warga pemerintah jadi otomatis bintang 1 overall publik jadi gak perlu jauh jauh kemari cari tempat
1,sangat jorok pengelola yg minta tiket per orang 10rb apa gk lama mah jadi tempat pembuangan akhir
1,sangat indah amansaat berliburan berakhir pekan bersama keluarga
1,bagus buahnya busuk busuk pohon keringgggggg jauhhhhh jalan rusakk diperhatikan lagiiii yg dr luar kota sangat kecewaaaa uang 50 ribu waktu terbuang sia sia
1,menjangkau lokasi sangat dekat kota palopo
1,taman dipinggir pantai padang kotor pasirnya coklat kurang terawat banyak orang jualan kalau malam
1,jutek banget bagian loket kasih uang 61000 kembalian 1000 entah kasih receh gimana aku sih masalah cuma dikembalikan 1000 kalo caranya beradab mana cara petugas loket megang uang kertas angkuh terkesan banyak duit olah uang receh gembiraloka sama sekali tukang parkir gantinya banyak preman parkir berperan watak pelayannya kayak gini bagusnya harga tiket turunkan jadi weekend 35000 weekday 25000
1,titik gmapsnya salah sebaiknya cek ignya utk tau alamat cottagenya
1,tempat terorganisir baik tiket masuk mahal tempat kotor bersama aitnya yabg keruh
1,sayang gk bs kasi bintang dibawah 1 masuk 8k 3tahun atas dapatnya cuma pekarangan doang parkir 10k lokasi sembrawut kolam masuk 30k tp gk worth it lah maen2an bayar lg dr luar keliatan bagus bgt hbs masuk lgsg pengen balik aja
1,kesana sabtu 11 mei 2024 baru jam 9 pagi terlalu rame buah nya kecil kecil besar besar mungkin panen duluan tempat masuk kebun menggelar buah besar besardengan harga 30 rb per kilo nya yg panen yg kecil kecil maundi bawa pulang timbang 30 rb per kilo nyabeli tiket 25 rb per orang kemudian pandu sampe lokasijalan sempit parkir sulitkalo mau beli saran mending beli pusat jangan lokasi pengalaman pusat lebih murah lengkapoleh lokasi petik apel lebih mahal pusat
1,banyak pengamen bikin risihmending suara bagus gitar fals suara fals
1,beli tiket 3 dikasih 6 tp disuruh tetep nombok tukang parkir gak sopan ditanyain karcis parkir malah songong ngomong nya parkir mahal dikasih 20rb gak dikembalikan gak worth it sih lebih baik tambah harga sedikit tp puas keluarga
1,camp mahal sewa tenda sama kasur hello kitty bantal selimut 300k 1 malam nego berkalikali harga normal katanya 400k500k udah sama kayak hotel pelayanannya kurang sampe yg disuruh angkat tenda yg luar dg alasan kalau yg didalam khusus tamu yg bawa tenda sendiri emangnya gk tamu kali yaa udah sewa mahal kebetulan bawa orang luar sampe teman bilang udah sewa mahal yg kerja capek pasang tenda akhirnya tanya petugasnya baru dipasangkannya nunggu maghrib sampe jam 9 an malam baru dipasang biaya masuk 40k per orang tempat nya lumayan bagus sih view pagi tepi danau yg cukup indah sewa tenda segitu gk sebanding rasanya pengalaman camp yg kurang menyenangkan
1,minimal jalan yg licin dekat wc umum ny sikat kalo gak licin kan biarpun byr parkir 5000 jg pengunjung ikhlas bayar udah goceng jalan kyk perosotan untung gak yg nyungsep
1,this place is a shame this place needs to be close its unethical and they keep rare wild animals in cage this should be illegal for people asking where are the tarsius i will answer they are dead tarsius cant stay alive in captivity a lot of scientific studies that you can easily find on google shows that tarsius in a cage will smash his own head on the cage hes doing so to try to free himself sadly his skull is very fragile and will eventually break this place is a shame for thewellbeingg of animals i hope you will close
1,pungli mengerikan depan udah d berentiin bayar 10rb per mobil masuk bayar 10rb per orang pas klwr bayar parkir 10rb per mobil mungkin tau bukan org lokal jd bener2 d 8kerjain tdk worthed sama skali mending ujong blang banyak pilihan cafe pinggir pantai
1,kecewa sih udah datang jauh2eh tak sesuai foto2 beredar tempat nya tempat terbengkalai terus sesuai nama tempat gak rekomen sih jadi terasa mahal tiket 25 ribu tempat
1,tak sesuai ekspektasi fasilitas alangkadarnya akses lokasi full debu ga kebayang disaat hujan tuh jalanan tak tertata rapi tanami pepohonan buat berteduh tarif parkir 10k buat yg lokasi pikir ulang kecewa
1,per juli 2019 lokasi wisata layak dikunjungi semua fasilitas yg hampir semuanya kayu hancur
1,tempat kurang terawat mau naik wahana jadi ngeri naik bianglala dalamnya sangat panas terpanggang petugas lumayan ramah membantu saran coba lihat2 dulu area wahananya jangan langsung beli terusan
1,indah sekali pemandangan kota pangkal pinang terlihat atas bukit kejora
1,taman baca hayluz tbh satusatunya perpustakaan kota baubau sulawesi tenggara konsep ruang terbuka lengkap aneka macam tanaman hias taman baca hayluz tak hadir berangkat cinta kesadaran sekelompok kecil anak muda menumbuhkan minat baca lingkungan tempat tinggalnya taman baca hayluz cinta lingkunganku perlu membaca kata pendiri tbh zulyah alagraph rabu 3052018 pendiri zulyah pemilik taman baca hayluz perempuan kelahiran juli 1990 alumnus jurusan jurnalistik universitas islam negeri uin alauddin makassar membangun pondok sederhana halaman rumahnya september 2016 zulya rutin melapak bacaan gratis pantai kotamara baubau sore akhir pekan dulu gelar masingmasing bersama satu orang teman namanya lia lapak bibliofilia satu namanya faldin melapak sendiri akhirnya disatukan satu samasama cinta buku katanya bermodal koleksi buku pribadi januari 2017 tepatnya halaman rumahnya jl betoambari no 45 taman baca hayluz berdiri kata zulyah biar cuma akhir pekan ditanya tb hayluz berdiri
1,kalo renang sekedar datang sangat rekomendasitapi kalo nginap sarankan dibicarakan baik2 fasilitaa apa ajaseprti pernah team alamipas chekout dihadapkan situasi pemakaian listrik berelebihankarna lampu sorot kolam renang sedang dibatasi hnya sampe jam 11dan situasi apa masuksebelum masuk ruang kamar ajak petugas sama2 melihat kondisi kamarnyakejaduan temanku yg menempati kamar tersebutpas masuk mngkin meja tersebut retak posisi persis belakang pintupas dibuka langsung kena pintuakhirnya balik tempat verifikasi
1,baru aja kesana masuk bayar 15k motor tempt terawat seprtinya sdh terbengkalai pdhl dlu rame byk penjual mkaman skrg sepiii zonk dah uang 15k terbuang sia2 hororrrr bnget jd milih lngsung pulang pdhl hari mggu tp gk org satupun
1,terawatareanya lumayan luascuma sayangnya terawat dgn baikutk restonya jgfailedpiringnya rada kotorgelas jg kotortoilet jg kotormeja2 jg kotorbnr2 kurang trawatalangkah baiknya dperbaiki smua bs mengundang wisatawan lokal dr luar kota
1,perna bermain bola dngn teman tman
1,penghuni asrama mimika pasmi pergi kelereng pantai holtekam berpisah liburan natal yg tdk libur yg berlibur bersamasama
1,terminal mandalika menyediakan bus tujuan kuta mandalika sercuit jm 8 pagi jm 9 pagi
1,terawat kotorbanyak sampah ayunan berkarat mau putusbahaya buat anak2 harga tiket lebaran 10 rb tiket resmi parkir mobil 10 ribu hahahahahahahahaha kocak
1,view danau bagus udara sejuk sayang lokasi ter urus tanda menuju lokasi jelas rajin tanya tanya penduduk setempat sangat ramah naik mobil direkomendasikan jalan lokasinya sempit cocok nya naik roda
1,pioneer camp sangat mengecewakan pergi menikmati pantai disini banyak punglinya bila kalian membaca review sebaiknya berpikirlah ulang datang kesini pertama kena biaya tiket 10000 rupiah katanya tiket diambil kampung tersebut mulai masuk lokasi jalannya jelek kedua ditempat parkir kena biaya parkir 10000 rupiah katanya beda pengelola mengutip tiket pertama ketiga kena biaya 5000 rupiah per orang masuk area pioneer camp protes banyak katanya bayar biaya kebersihan fasilitasnya jelas bukan orang pertama kali pergi pantai paling parah pengelolaan tempat rekreasi diambil alih pemda lhokseumawe jangan dikelola sama penduduk jelas sebaiknya berekreasi kemari cari pantai2 kota lhokseumawe
1,usia 2 tahun ikut sama kedua orang tua main dicurug sawer aktivitas ibu berkebun disamping curug amoh milik ditanah milik aki jaka atas air terjun curug sawer kalau air terjun curug sawer menanam padi ditanah milik nenek hatmi rutinitas kegiatan orang tua nyangkul nanam padi panen musim nanam padi dulu disekitar pesawahan disamping air terjun sumber airorang sunda bilang burialan air keluar tengah sawah pinggir sawah diburialan banyak sekali berbagai ikan kecil disebut orang sunda ikan benteur paray endol jadi mainan asik mengambil ikan alat bakulboboko diisi nasi sedikit direndamkan air tersebut nasi sebagi alat memanycing ikan ngumpul masuk bobiko kalau terlihat kumpul diangkat boboko ikan ikan kecil banyak beberapa kali menaruh boboko kosong dikasih nasi sedikit isi kelapa disaat istirahat orang tua waktunya makan siang kadang dipepes dibakar ikan kecil kecil utu dipanggang pake lidi kelapa nah atas pesawahan bawah tebing banyak sekali bangkoang tumbuh sendiri bebas pulang rumah selalu bawa bengkoang hasil nyari pingir air terjun curug sawer cabe rawit tumbuh bebas sekarang tetap lestari lumayan buat nyambel mah mudah mendapatkannya ditahun 2002 pernah menanam cabe dilahan milik pak mahmud nyampai air terjun ribuan batang cuma sekali panen selanjutnya banyak bebas memetik buah cabe tersebut baik nyambel dirumah orang mengunjungi maupun warga aktifitas air terjun cita cita menata air terjun satu air terjun jadi tempat menghasilkan bertema pertanian baik cabe jagung semangka dsbnya apa selaku orang membuktikan berbagi tanaman cocok diproduksi disekitar desa mandalamekar desa mandalahurip kec jatiwas kab tasik malaya jadi dibangkitkan disegi pertanian memanfaatkan lahan disekitar terjun sahabat mengunjungi tak bosan main air terjun segala hasil tani dikosumsi dilokasi maupun buat keluarga dirumah murni petani air terjun sayang detik menulis digogle baik pemerintah setempat sadar air terjun curug sawer jadi sumber pendapatan lebih baik masyarakat desa menantikan sosok sosok orang jelas membangun dialam desa nyata dikelola bila punya modal cukup bukan petani biasa perlu bantuan orang manpun membuat pergerakan masyarakat sekian coretan barang kali mau kerja sama membentuk kegiatan masyarakat didesa bertemu digubuk kampung ciomas atasnya air terjun tak butuh orang orang pandai membuat wancana banyak gagalnya saatnya beraksi nyata wasalam
1,tempatnya menang luas aja gk yg dlihatgak terawatkurang bersihkyk gak petugas kebersihanmushola jg gk terawatjual makanan jg mhalksni pas hari minggu tp yg dtng gak rame mngkin bnyak yg kecewasekali dtng hbs tu gk mau dtng lg gak sesuai harapan sih
1,berisiko berada tikungan jalan kamar kecil air buruk
1,tempat wisata ziarah yg penuh parkir liar banyak tukang palaknya tempat yg dijaga dikelola malah dipenuhi oknum2 parkir premanisne yg mengganggu membuat resah
1,this is indeed a beautiful place with some magnificent trees but it is advertised as a hot spring with a swimming pool which is not really true i arrived on a weekday especially from jakarta what a waste of a two hour drive the only hot springs experience is a small cubicle with a bath full of luke warm mineral water im sure it could be therapeutic but then dont advertise it as a hot spring compared with the hot springs in bandung it is a joke the swimming pool was closed for cleaning not recommended
1,tempatnya enak pelayanannya mengecewakan cukup sekali 
1,jangan datang kesini tempat dibuka layak pakai bener bener terbengkalai wahananya digunakan
1,penataan layak tempat wisata jalan kendaraan roda 4 tersedia berupa tanah kering keras lahan parkir disediakan semua pembenahan alat berat beroperasi semoga tahun depan selesai dinikmati tempat wisata
1,fasilitas perbaiki banyak mainan rusak bikin gazebo kek sama perbanyak pohon
1,as a foreigner you pay 25 000 rupiah 10 000 for the locals and you have no explanations whatsoever at least in the water palace there are many guides who explain stuff and show you around here its just a big empty space the local people get tour guides though
1,entahlah mending dikasih htm tiap masuk titik lokasi main air dikenakan 5rborang disana kurang lebih 3 4 titik main air masuk area dimintain seiklasnya kirain dah bebas main air dimanapun eh ternyata  tiap toilet bayar ganti baju bayar disarankan kalau main air pake sandal dasarnya batu2 sakitlicin lihat ular kayak anakan anaconda untung dah selesai main air bocil2ku cuma penasaran aja hari minggu rame polll cukup 1x deh ngobatin rasa penasaran parkir motor 5rb toilet 2rb3rb main air tiap titik lokasi 5rborang htm seiklasnya saran mending dikasih htm yg jelas eksplore sepuasnya drpd gini heemmmmmmmm entah bagaimana konsepnya
1,tlg perbaiki lg smua fasilitas2nya terutama kamar mandi
1,wahana yg paling panassss pengap ga sirkulasi udara matahari kalah panas keluar dr sini langsung pusing sakit kepala parah
1,ngeri pas kesana dipaksa ngasih uang padahal sdh ngisi kotak amal disediakan mau keluar dr makan kuncen nya bicara nada mengintimidasi kemudian sm penjaga pintu diminta ngasih uang kuncen nya jalan arah tempat parkir diikiti bbrp orang maksa minta uang serem banget deh berasa aman
1,panas banyak angin masuk 1 pedmot 2 orang rp 13k bonsai letaknya bukit penuh pohon jati kering habis bakar jadi panas banget kalo mau foto bayar 1 spot foto rp 2000 paket 5 spot foto rp 5000 jauh pusat kota
1,tempat n makanannya tersedia banyak tukang jualan gerobak disana
1,view cakep buanget parkiran luas terjal becek meskipun hujan usai jembatan sebagian lapuk datang bawa rombongan pelayanan restoran ala kadarnya jangan pesen kopi ekspektasi tinggi espresso machine grinder kopinya pakai sachet petugasnya menyampaikan sendiri order capucino no sugar black americano kak kalo ga pakai gula cappucinonya manis soalnya tinggal seduhtrus mesin buat apa yaa taruh aja disini apologize harga 23rb nett sangat sangat menipu
1,pengurus nya pemalas datang jumat 19 april 2024 jam 1400 alasan dibuka umum rombongan tamu khusus mau berkunjung lah apa salahnya tetap dibuka umum meski tamu rombongan khusus sebuah organisasi memangnya kunjungan tamu biasa berjumlah 2 orang mengganggu tamu khusus memangnya minta pemandutour guide penjelasan makanya gamau dibuka iya kalo tamu khususnya presiden dimaklumi alasan keamanan samasama publik kesimpulan buat turis turis luar jangan mau buang buang waktu sini cuma buat lihat museumnya tutup alasan cukup konyol jadwal tamu rombongan khusus mending gunakan waktu berharga tempat wisata update bacalah balasan pengurusnya menyalahkan membaca padahal baru update google work hours 1 week ago terhitung menulis revisi review review hari ditanggali 30 april 1 minggu 30 april 23 april berkunjung 19 april kalo mau berkembang terima kritik saran malah menyalahkan pengunjung cerdas wkwkwk tolol
1,tukang parkirnya bego depan parkiran banyak tp mobil tahan tengah bikin stuck macet parah utk pungli okelah separah tanjung kait
1,mengerti lokasi pasar marakas sebut taman marakas pondok unggu bukan lokasi taman terdapat taman tempat bermain terdapat kumpulan ruko tutup sebut taman ngawur buat titik lokasi photo diupload banyak ngawur posisi lokasi rainbow lake danau marakas malah upload hadeuh
1,lumayan salah satu tempat nongkrong sore buat refreshing melepaskan penat walaupun kurang fasilitasnya memang cirebon kurang mungkin dibilang ga taman terbuka umum yg nyaman keluarga pemimpin daerah cirebon buatkan wahanataman umum
1,tiketnya sangat mahal rp15000kepala jalannya spt jaman belanda wahana ancur semua g layaklebih baik pantai sj
1,berkunjung pulau cangkir petugas melakukan pemerasan orang ziarah dalih parkir bus medium 34 lima puluh ribu ditambah naik angkot per 10 orang bayar 100 ribu rupiah per orang 10 ribu petugas ditindak lanjuti terjadi halhal disukai peziarahsekian terima kasih
1,menyengkan segar airnya jernih dingin cogan cogan ganteng
1,kolam nya banyak lumutnya pelayanan loketnya ramah alias cemberut semua ga worthit si lebih mau mengingat kan aja customer raja
1,tempatnya bagus berada madinah tp sayang jamaah wanita gak masuk masjidnya wanita sholatnya mushola tempatnya berada sebelah masjid payung madinah sangat mengecewakan sekali
1,tempatnya kotor tempat bilas sangat kotor banyak sampah lumut wc banyak yg rusak saran masukan pengelola kolam menjaga kebersihan arel kolam sampah lumut aroma tak sedap tak tercium pengunjung bukan pemasaran nya yg bagus pemeliharaan kolam renangnya jg baik pengunjung ramai datang bukan krn promo tiketnya kenyamanan pengunjung utamakan
1,tukang parkir ga ngotak masa iya sepeda aja parkirnya 5000 motor 2000 teman dipalakin membawa kayu maksudnya apa yah kalo nyari uang bener gausa malak anak kecil nas kleng ci madak plot cai pelot mani
1,sangatsangat mengecewakan lokasinya kotorkemproh banget orang hendak nyekar disarankan hendak mengenal berwisata tepi laut padahal beberapa tahun lalu lumayan tiket masuk tergolong sangat mahal 25rb pantai kemproh banget dijamin balik sini sangatsangat terpaksa pilihan
1,tempatnya se estetik dl dgn view alamnya kolamnya banyak pilihan mau yg kolam kecil yg panjang yg terbuka tertutup jg tp hr kesini niat mau berendam air belerang hangat eh malah kecewa tempatnya ngga naik keatas tp dibawah posisinya kesamping jalannya dr loket tiket utk masuk kolamnya airnya dingin belerangnya jg jauh lebih sedikit dr yg sebelumnya kolamnya jg kek kolam bocil berbentuk bulatan gt cm 2 mah 1 keluarga dtg jg udh penuh 1 kolam bayangkan klo lg bnyk yg dtg apa kgk umpel2an tu berendamnya awalnya sy tiket beli 2 harga nya 30000 krn ngga jd berendam akhirnya sy kembalikan tiketnya untungnya refund 15000 aja lumayan dh drpd ngga bs refund sama sekali
1,petugasnya menjalankan kereta ramahpetugasnya marah marah jelaspatungnya cacatsuaranya kemresek jelas
1,sedih bgt kesini kirain dapet tempat yg enak buat sekedar jalan sore nyari angin apa zonk bgtkenapa yg jualan jd pindah lokasi parkir meja meja yg udh sediain buat jualan malah kosong mlompongaku gak tau sejak kapan begini bahkan tulisan situ cipondoh huruf s nya aja udh ilang wow bgtblm kang parkir yg semena mena udh kayak reman mnta uang parkir 3 rebu padahal br naro motor jelas jelas tulisan parkir gratis
1,bru bbrpa mnggu lalu ksnitempatny ga keurus lgisunyi sepi ga ad pengunjung skilas kya angker jdinya sampah daunnya bnyaksungguh ironispdhl klo dikelola dgn baik wisata sngt bgus utk kumpul tlong pihak yg berwenang kelola lah wisata jgn dbiarkn sjakrna mnrut wisata cukup mnjamin utk wisata dmsa depan dkelola dgn baiksmoga yg baca
1,akses jalan nya khas pedalaman suku batu benyek  pribumi merasa isin  jalan jalan yg coran dulu ancoorr  komentar berubah akses jalan memadai
1,cukup sekali gak mau sini masuk bayar tempat kayak gak kelola baik banyak lalat jorok kotor pesen indomie aja lama bgt pelayanannya masuk bayar tpi toilet tetep bayar gak tisue nya
1,tempatnya kotor sekali sampah berserakan lantai kolam ikan rumput sintetis nya yg lembab kena air buangan ac atap gedung kelurahan sayang sekali segera dilakukan perbaikan
1,komentar base on kunjungan 18 april 2024 ga rekomended banget airnya terlalu kaporit perih mata pengar hidung kalau ketelen sakit kayak terbakar tenggorokan lingkungan kurang terawat rumput ga dipotong ruang ganti gelap pesing langit2nya berlumut mau ambrol kolam arusnya kotor banget arusnya ga jalan semprotan ga nyala keramik banyak mengelupas melukai kaki keseluruhan benar terlalu mahal dibanding pengelola kayk udah ga niat baca ternyata dah banyak review buruk soal keramik pecah cuma yg ngasih ulasan memberi rate tinggi jadi mungkin ga ngaruh owner revisi bintang 2 1
